company_id,company,year,barriers,topic
5,SSAB,2018,Financial implications due to climate change,1
5,SSAB,2018,Other risks due to climate change,1
5,SSAB,2018,High energy intensity,6
5,SSAB,2018,Difficulty in reducing energy consumption,6
5,SSAB,2018,Limited availability of recycled input materials,2
5,SSAB,2018,Limited availability of information on disposal methods for waste,-1
5,SSAB,2019,Financial implications due to climate change,1
5,SSAB,2019,Other risks due to climate change,1
5,SSAB,2019,Opportunities due to climate change,1
5,SSAB,2019,Anti-corruption policies and procedures communication and training,0
5,SSAB,2019,Anti-corruption policies and procedures effectiveness,0
5,SSAB,2019,Limited availability of recycled input materials data,2
5,SSAB,2019,Limited availability of information on disposal methods at a group level,-1
5,SSAB,2019,Limited availability of information on disposal methods due to reporting development,-1
5,SSAB,2019,Limited availability of information on energy consumption intensity,6
5,SSAB,2019,Limited availability of information on energy reduction,6
5,SSAB,2019,Limited availability of information on water withdrawal by source,0
5,SSAB,2019,Limited availability of information on direct GHG emissions,16
5,SSAB,2019,Limited availability of information on indirect (Scope 2) GHG emissions,16
5,SSAB,2019,Limited availability of information on indirect (Scope 3) GHG emissions,16
5,SSAB,2019,Limited availability of information on GHG emissions intensity,16
5,SSAB,2019,Limited availability of information on GHG emissions reduction,16
5,SSAB,2019,Limited availability of information on nitrogen oxides (NO X ) and sulfur oxides (SO X ) emissions,16
5,SSAB,2019,Limited availability of information on other significant air emissions,16
5,SSAB,2020,High production costs of fossil-free steel,0
5,SSAB,2020,Limited availability of low-carbon steel production technologies,0
5,SSAB,2020,High upfront investment costs for new production technologies,0
5,SSAB,2020,Limited scalability of current low-carbon steel production methods,0
5,SSAB,2020,High costs of raw materials for low-carbon steel production,0
5,SSAB,2020,Limited availability of low-carbon energy sources,4
5,SSAB,2020,High costs of carbon capture and storage technologies,8
5,SSAB,2020,Limited public acceptance of new low-carbon steel production technologies,15
5,SSAB,2020,High costs of recycling and reusing steel,0
5,SSAB,2020,Limited availability of low-carbon steel recycling technologies,0
5,SSAB,2020,High costs of implementing new production processes,0
5,SSAB,2020,Limited availability of skilled labor for low-carbon steel production,0
5,SSAB,2020,High costs of research and development for new low-carbon steel technologies,0
5,SSAB,2020,Limited availability of funding for low-carbon steel production projects,0
5,SSAB,2020,High costs of implementing new regulations and standards for low-carbon steel production,0
5,SSAB,2020,Limited availability of low-carbon steel production data and metrics,0
5,SSAB,2020,High costs of monitoring and reporting on low-carbon steel production,0
5,SSAB,2020,Limited availability of low-carbon steel production standards and certifications,0
5,SSAB,2020,High costs of ensuring supply chain transparency and accountability for low-carbon steel production,0
5,SSAB,2020,Limited availability of low-carbon steel production certifications and labels,0
5,SSAB,2020,High costs of implementing new supply chain management systems for low-carbon steel production,0
5,SSAB,2020,Limited availability of low-carbon steel production data and analytics tools,0
5,SSAB,2020,High costs of ensuring compliance with low-carbon steel production regulations and standards,0
5,SSAB,2020,Limited availability of low-carbon steel production training and education programs,0
5,SSAB,2020,High costs of implementing new low-carbon steel production technologies in existing production facilities,0
5,SSAB,2020,Limited availability of low-carbon steel production technologies that are compatible with existing production equipment,0
5,SSAB,2020,High costs of ensuring the quality and consistency of low-carbon steel production,0
5,SSAB,2020,Limited availability of low-carbon steel production technologies that can produce high-quality steel,0
5,SSAB,2020,High costs of implementing new quality control measures for low-carbon steel production,0
5,SSAB,2020,Limited availability of low-carbon steel production technologies that can produce steel with consistent properties,0
5,SSAB,2020,High costs of ensuring the safety and health of workers in low-carbon steel production,0
5,SSAB,2020,Limited availability of low-carbon steel production technologies that can reduce worker exposure to hazardous materials,0
5,SSAB,2020,High costs of implementing new safety and health measures for low-carbon steel production,0
5,SSAB,2020,Limited availability of low-carbon steel production technologies that can reduce energy consumption,0
5,SSAB,2020,High costs of implementing new energy efficiency measures for low-carbon steel production,0
5,SSAB,2020,Limited availability of low-carbon steel production technologies that can reduce water consumption,0
5,SSAB,2020,High costs of implementing new water efficiency measures for low-carbon steel production,0
5,SSAB,2020,Limited availability of low-carbon steel production technologies that can reduce waste generation,0
5,SSAB,2020,High costs of implementing new waste reduction measures for low-carbon steel production,0
5,SSAB,2020,Limited availability of low-carbon steel production technologies that can reduce greenhouse gas emissions,0
5,SSAB,2020,High costs of implementing new greenhouse gas reduction measures for low-carbon steel production,0
5,SSAB,2020,Limited availability of low-carbon steel production technologies that can reduce air pollution,0
5,SSAB,2020,High costs of implementing new air pollution reduction measures for low-carbon steel production,0
5,SSAB,2020,Limited availability of low-carbon steel production technologies that can reduce noise pollution,0
5,SSAB,2020,High costs of implementing new noise pollution reduction measures for low-carbon steel production,0
5,SSAB,2020,Limited availability of low-carbon steel production technologies that can reduce soil pollution,0
5,SSAB,2020,High costs of implementing new soil pollution reduction measures for low-carbon steel production,0
5,SSAB,2020,Limited availability of low-carbon steel production technologies that can reduce water pollution,0
5,SSAB,2020,High costs of implementing new water pollution reduction measures for low-carbon steel production,0
5,SSAB,2020,Limited availability of low-carbon steel production technologies that can reduce land pollution,0
5,SSAB,2020,High costs of implementing new land pollution reduction measures for low-carbon steel production,0
5,SSAB,2020,Limited availability of low-carbon steel production technologies that can reduce waste disposal costs,0
5,SSAB,2020,High costs of implementing new waste disposal measures for low-carbon steel production,0
5,SSAB,2020,Limited availability of low-carbon steel production technologies that can reduce energy costs,0
5,SSAB,2020,Limited availability of low-carbon steel production technologies that can reduce raw material costs,0
5,SSAB,2020,High costs of implementing new raw material efficiency measures for low-carbon steel production,0
5,SSAB,2020,Limited availability of low-carbon steel production technologies that can reduce labor costs,0
5,SSAB,2020,High costs of implementing new labor efficiency measures for low-carbon steel production,0
5,SSAB,2020,Limited availability of low-carbon steel production technologies that can reduce maintenance costs,0
5,SSAB,2020,High costs of implementing new maintenance efficiency measures for low-carbon steel production,0
5,SSAB,2020,Limited availability of low-carbon steel production technologies that can reduce downtime costs,0
5,SSAB,2020,High costs of implementing new downtime reduction measures for low-carbon steel production,0
5,SSAB,2020,Limited availability of low-carbon steel production technologies that can reduce production costs,0
5,SSAB,2020,High costs of implementing new production efficiency measures for low-carbon steel production,0
5,SSAB,2020,Limited availability of low-carbon steel production technologies that can reduce transportation costs,0
5,SSAB,2020,High costs of implementing new transportation efficiency measures for low-carbon steel production,0
5,SSAB,2020,Limited availability of low-carbon steel production technologies that can reduce storage costs,0
5,SSAB,2020,High costs of implementing new storage efficiency measures for low-carbon steel production,0
5,SSAB,2020,Limited availability of low-carbon steel production technologies that can reduce handling costs,0
5,SSAB,2020,High costs of implementing new handling efficiency measures for low-carbon steel production,0
5,SSAB,2020,Limited availability of low-carbon steel production technologies that can reduce packaging costs,0
5,SSAB,2020,High costs of implementing new packaging efficiency measures for low-carbon steel production,0
5,SSAB,2020,Limited availability of low-carbon steel production technologies that can reduce waste generation costs,0
5,SSAB,2020,Limited availability of low-carbon steel production technologies that can reduce energy consumption costs,0
5,SSAB,2020,Limited availability of low-carbon steel production technologies that can reduce water consumption costs,0
5,SSAB,2020,Limited availability of low-carbon steel production technologies that can reduce greenhouse gas emissions costs,0
5,SSAB,2020,Limited availability of low-carbon steel production technologies that can reduce air pollution costs,0
5,SSAB,2020,Limited availability of low-carbon steel production technologies that can reduce noise pollution costs,0
5,SSAB,2020,Limited availability of low-carbon steel production technologies that can reduce soil pollution costs,0
5,SSAB,2020,Limited availability of low-carbon steel production technologies that can reduce water pollution costs,0
5,SSAB,2020,Limited availability of low-carbon steel production technologies that can reduce land pollution costs,0
5,SSAB,2020,Limited availability of low-carbon steel production technologies that,0
5,SSAB,2021,Involvement in many research projects on technological developments,0
5,SSAB,2021,"Climate change, reducing CO 2 emissions and other environmental impacts",-1
5,SSAB,2021,"Reducing emissions, noise and other inconveniences",1
5,SSAB,2021,"Engagement and meetings with representatives (politicians, regulators, general public, media) and people living close to the production sites",11
5,SSAB,2021,Open communication and interaction,11
5,SSAB,2021,Open communication and active engagement,11
5,SSAB,2021,Collaboration with industry associations,-1
5,SSAB,2021,Strengthening governance around corporate climate lobbying,0
5,SSAB,2021,Developing assessment of member associations,-1
5,SSAB,2021,Developing procedure on action where industry associations and/or other member organizations are not aligned with the Paris Agreement's goals or own objectives,-1
5,SSAB,2024,ESRS E1-5 37,-1
5,SSAB,2024,ESRS E1-5 38,-1
5,SSAB,2024,ESRS E1-5 40-43,-1
5,SSAB,2024,ESRS E1-6 44,-1
5,SSAB,2024,ESRS E1-6 53-55,-1
5,SSAB,2024,ESRS E1-9 66,-1
5,SSAB,2024,ESRS E1-9 66a,-1
5,SSAB,2024,ESRS E1-9 66c,-1
5,SSAB,2024,ESRS E1-9 67c,-1
5,SSAB,2024,ESRS E1-9 69,-1
5,SSAB,2024,ESRS E2-4 28,-1
5,SSAB,2024,ESRS E3-1 9,-1
5,SSAB,2024,ESRS E3-1 13,-1
5,SSAB,2024,ESRS E3-1 14,-1
5,SSAB,2024,ESRS E3-4 28c,-1
5,SSAB,2024,ESRS E3-4 29,-1
5,SSAB,2024,ESRS 2 GOV-1 21d,-1
5,SSAB,2024,ESRS 2 GOV-1 21e,-1
5,SSAB,2024,ESRS 2 SBM-1 40 d ii and iii,-1
5,SSAB,2024,ESRS 2 SBM-1 40 d iv,-1
5,SSAB,2024,ESRS E1-1 14,-1
5,SSAB,2024,ESRS E1-1 16 g,-1
5,SSAB,2024,ESRS E1 SBM-3,-1
5,SSAB,2024,ESRS E1-4 34,-1
5,SSAB,2024,ESRS S3-1 16,-1
5,SSAB,2024,ESRS S3-1 17,-1
5,SSAB,2024,ESRS S4-1 16,-1
5,SSAB,2024,ESRS S4-1 17,-1
1,ArcelorMittal,2014,"Geo-political realities driving energy policy and supplies, including regulations relating to carbon emissions.",4
1,ArcelorMittal,2014,Pipeline of talented scientists and engineers for tomorrow.,10
1,ArcelorMittal,2014,Transparency in governance.,0
1,ArcelorMittal,2014,"Human rights policy and commitments to workforce, local communities, and business partners.",0
1,ArcelorMittal,2014,Energy usage and costs.,6
1,ArcelorMittal,2014,Supply chains that our customers trust.,0
1,ArcelorMittal,2014,Stakeholder expectations and long-term global sustainability trends.,-1
1,ArcelorMittal,2014,"Infrastructure, such as deep-water port facilities, railway sidings, and engineering workshops.",0
1,ArcelorMittal,2014,Cyclicality of the steel industry and raw materials prices.,0
1,ArcelorMittal,2014,Market needs and customer requirements.,1
1,ArcelorMittal,2014,Higher value-added products in our product mix.,1
1,ArcelorMittal,2014,Downstream integration and operational efficiencies.,-1
1,ArcelorMittal,2015,Breakthrough technologies may take more than a decade to develop and implement.,0
1,ArcelorMittal,2015,The economics of breakthrough technologies need to be right for their adoption to become a reality.,0
1,ArcelorMittal,2015,Policy frameworks need to be in place to ensure the commercial viability of breakthrough technologies.,0
1,ArcelorMittal,2015,Emerging policies in Europe will not facilitate industry's contribution to climate change and economic growth.,0
1,ArcelorMittal,2015,A regional carbon pricing system will not reduce global carbon emissions due to 'carbon leakage'.,14
1,ArcelorMittal,2015,A globally consistent carbon pricing system is needed to drive a reduction in CO2 from steel production.,0
1,ArcelorMittal,2019,No mechanism to address high risk of steel production being structurally uncompetitive in affected countries/regions,0
1,ArcelorMittal,2019,Marginal steel CO 2 reductions globally as production shifts to less carbon-regulated jurisdictions,0
1,ArcelorMittal,2019,Limited progress towards goals of Paris Agreement,-1
1,ArcelorMittal,2019,"Countries and regions that introduce a cost of CO 2 emissions, but with neither supportive energy policies nor effective mechanisms to maintain the competitiveness of low-emissions versus higher-emissions steel, will fail to decarbonise their steel",0
1,ArcelorMittal,2019,"Without effective mechanisms to offset the structurally higher operating costs of deploying low-emissions technologies, and affordable access to the clean energy they need, the steel industry will be unable to make the necessary shift needed to meet the goals of the Paris Agreement",0
1,ArcelorMittal,2019,"Scrap, unfortunately, is not a sufficient answer as there is not enough scrap available in the world to simply make all steel through the electric arc furnace process",0
1,ArcelorMittal,2020,High carbon footprint associated with steelmaking,0
1,ArcelorMittal,2020,Comparative disadvantage of steel in terms of carbon footprint compared to other materials,0
1,ArcelorMittal,2020,Challenge of the transition to a low-carbon economy,-1
1,ArcelorMittal,2020,"Difficulty in reducing GHG emissions in ""hard to abate sectors""",16
1,ArcelorMittal,2021,Economic developments,1
1,ArcelorMittal,2021,Uncertainties over the pace of transition to low-emission technologies,0
1,ArcelorMittal,2021,Political and environmental actions that will be taken to meet the carbon reduction goals,-1
1,ArcelorMittal,2021,Regulatory changes,1
1,ArcelorMittal,2021,Emissions activity arising from climate-related matters,-1
1,ArcelorMittal,2021,Ineffectiveness of the CBAM proposal against carbon leakage,14
1,ArcelorMittal,2021,Insufficiency of provisions to address circumvention risks,0
1,ArcelorMittal,2021,Uncertainty in the timing or adoption of the CBAM proposal,14
1,ArcelorMittal,2021,Uncertainty in the implementation of the CBAM proposal,14
1,ArcelorMittal,2021,High cost of carbon,8
1,ArcelorMittal,2021,High cost of decarbonization technologies,0
1,ArcelorMittal,2021,High cost of emissions allowances,13
1,ArcelorMittal,2021,Shortage in free allocation of CO2 emissions allowances,13
1,ArcelorMittal,2021,"Fluctuations in energy, natural gas, and industrial gas costs",6
1,ArcelorMittal,2021,Disruption in the transmission of energy,4
1,ArcelorMittal,2021,Inadequate energy transmission infrastructure,4
1,ArcelorMittal,2021,Termination of energy supply contracts,4
1,ArcelorMittal,2021,Lack of governmental and societal support for decarbonization,15
1,ArcelorMittal,2021,Changes in government and policy,1
1,ArcelorMittal,2021,Uncertainty in the cost of decarbonization,0
1,ArcelorMittal,2021,Uncertainty in the timing of the implementation of changes,0
1,ArcelorMittal,2021,Uncertainty in the effectiveness of decarbonization technologies,0
1,ArcelorMittal,2021,Uncertainty in the maturity and efficiency of decarbonization technologies,0
1,ArcelorMittal,2021,Uncertainty in the level of public funding for decarbonization,0
1,ArcelorMittal,2021,Uncertainty in the level of support from host countries,0
1,ArcelorMittal,2021,Uncertainty in the level of compensation for higher costs,0
1,ArcelorMittal,2021,Uncertainty in maintaining a fair and competitive landscape,0
1,ArcelorMittal,2022,"The risk of future developments affecting assumptions on costs, government and societal support for carbon emissions reduction, and technology advancement.",0
1,ArcelorMittal,2022,"A lack of governmental and societal support could make ArcelorMittal's targets more costly, more difficult or even impossible to achieve.",-1
1,ArcelorMittal,2022,"The predictability of the regulatory environment and business environment needs to evolve, especially for hard-to-abate sectors.",0
1,ArcelorMittal,2022,The Company's expectation that public funding covers 50% of the total cost of decarbonization may not be achieved.,0
1,ArcelorMittal,2022,The financial impact of incurring significant additional costs to acquire emissions allowances due to a shortage in free allocation.,13
1,ArcelorMittal,2022,The risk of frameworks and regulations being adopted that are ill-adapted to ArcelorMittal's operations.,-1
1,ArcelorMittal,2022,The risk of the European Union's ETS and CBAM not being effective in avoiding competitive distortions.,14
1,ArcelorMittal,2022,The risk of the market outsourcing steel production to regions with less stringent carbon policies.,0
1,ArcelorMittal,2022,The risk of the Inflation Reduction Act in the United States not being effective in accelerating investment in low-carbon steel-making.,0
1,ArcelorMittal,2022,The risk of the EU net Zero Industry Act not being effective in aligning with a net-zero economy.,0
1,ArcelorMittal,2022,The risk of the regulatory environment not evolving to support the transition to net-zero.,0
1,ArcelorMittal,2023,"Decrease of steel demand compared to business as usual, due to increased material efficiency and product lifetimes, and increased circularity.",0
1,ArcelorMittal,2023,"Restrictions on clean energy scalability, which can have significant impacts on our decarbonisation costs in some regions.",0
1,ArcelorMittal,2023,Climate and industrial policies between regions not being aligned may lead to carbon leakage.,-1
1,ArcelorMittal,2023,If the Company is unable to make the necessary investments to decarbonize and reach its 2030 decarbonization targets due to the design of governmental policy in Europe or other jurisdictions where it operates.,0
1,ArcelorMittal,2023,"Failure to achieve the level of innovation that is necessary to keep us at the forefront of our industry, due to ongoing rapid changes in technologies and legislations.",0
1,ArcelorMittal,2023,Competition from other materials and alternative steel-based technologies could reduce market prices and demand for steel products and thereby reduce ArcelorMittal’s cash flows and profitability.,0
1,ArcelorMittal,2023,"Strikes affecting operations at various plants, particularly in Mexico, South Africa, France, Spain and Canada, relating to various causes, often in connection with labor contract renewal negotiations or claims for salary increases because of rising inflation.",0
1,ArcelorMittal,2023,"Decommissioning costs: Over the next ten years, the retirement of certain above-mentioned assets in the context of the transition to low-carbon steelmaking infrastructures may lead to certain decommissioning costs.",0
1,ArcelorMittal,2023,"A lack of governmental and societal support could make the Company’s targets more costly, more difficult or even impossible to achieve.",-1
1,ArcelorMittal,2023,"A fair competitive landscape that accounts for the global nature of the steel market, ensuring domestic production and imports are subject to equivalent GHG reduction regulations and incentives, such as a fairly and internationally applied Emissions Trading Scheme (ETS) is not guaranteed.",0
1,ArcelorMittal,2023,Financial support to innovate and make long-term investments and neutralize the higher operating costs of low and zero carbon-emissions steelmaking is not guaranteed.,0
1,ArcelorMittal,2023,Access to sufficient clean energies at affordable price levels is not guaranteed.,4
1,ArcelorMittal,2023,Incentives to encourage the consumption of low- and zero-carbon emissions steel over higher carbon emissions steel are not guaranteed.,0
1,ArcelorMittal,2023,"High gas prices have previously limited the adoption of DRI-EAF operations, and this could be a barrier to transitioning to natural-gas based DRI-EAF and eventually green hydrogen technology solutions.",1
1,ArcelorMittal,2023,"The effectiveness of the CBAM proposal against carbon leakage is untested, the provisions to address circumvention risks, including resource shuffling and cost absorption, seem insufficient, and no solution for exports has been yet considered.",14
1,ArcelorMittal,2024,Uncertainties over the pace of transition to low-emission technologies.,0
1,ArcelorMittal,2024,Political and environmental actions that will be taken to meet the carbon reduction goals.,-1
1,ArcelorMittal,2024,Regulatory changes and emissions activity arising from climate-related matters.,-1
1,ArcelorMittal,2024,Lack of governmental and societal support for decarbonization.,15
1,ArcelorMittal,2024,Design of governmental policy in Europe or other jurisdictions that may hinder decarbonization efforts.,0
1,ArcelorMittal,2024,Insufficient amount of CO2 emission allowances to satisfy technically achievable operating conditions.,13
1,ArcelorMittal,2024,Significant increases in prices for emissions allowances.,13
1,ArcelorMittal,2024,Ineffectiveness of the Carbon Border Adjustment Mechanism (CBAM) in addressing circumvention risks.,14
1,ArcelorMittal,2024,"Insufficient provisions to address circumvention risks, including resource shuffling and cost absorption.",-1
1,ArcelorMittal,2024,No solution for exports under the CBAM.,14
1,ArcelorMittal,2024,Uncertainty over the effectiveness of environmental regulations in various jurisdictions.,0
1,ArcelorMittal,2024,"Negative effect of environmental regulations on ArcelorMittal's production levels, income, and cash flows.",-1
1,ArcelorMittal,2024,Higher costs and lower sales due to environmental regulations affecting suppliers and customers.,-1
1,ArcelorMittal,2024,"Fluctuations in electricity, natural gas, and industrial gas prices.",6
1,ArcelorMittal,2024,Supply disruptions and curtailments of energy supplies.,4
1,ArcelorMittal,2024,Geopolitical conflicts and destructions of gas pipelines affecting energy supplies.,4
1,ArcelorMittal,2024,Collapse in demand due to supply issues or otherwise.,1
1,ArcelorMittal,2024,Uncertainty over the costs of green hydrogen and its evolution over time.,1
1,ArcelorMittal,2024,Uncertainty over the construction of DRI and EAF facilities.,-1
1,ArcelorMittal,2024,Uncertainty over the development of CCUS infrastructure.,8
1,ArcelorMittal,2024,Uncertainty over the timing of the introduction of GHG reduction requirements and supportive policies in applicable jurisdictions.,0
1,ArcelorMittal,2024,"Need for further support from host countries, particularly the European Union and its Member States, to maintain a fair and competitive landscape.",0
1,ArcelorMittal,2024,"Concerns over ""carbon leakage"" and the need for compensation for higher costs.",14
1,ArcelorMittal,2025,Strategic tension between capital return policy and long-term allocation of capital for decarbonisation.,0
1,ArcelorMittal,2025,Inability to report Scope 3 emissions associated with raw material extraction and joint ventures.,16
1,ArcelorMittal,2025,Delay in releasing the Climate Action Report 3.,13
1,ArcelorMittal,2025,Uncertainty regarding competitors' ability to achieve 1.5°C pathway targets.,13
1,ArcelorMittal,2025,High prices of green hydrogen.,1
1,ArcelorMittal,2025,Difficulty in achieving originally stated goal of the Sestao plant.,5
1,ArcelorMittal,2025,Limited enabling conditions for producing low-carbon emissions steel.,0
16,Baosteel,2018,Strict coal consumption constraint,13
16,Baosteel,2021,risk of implementing carbon peaking and carbon neutrality,0
16,Baosteel,2021,technology risks,1
16,Baosteel,2021,carbon trading cost risks,14
16,Baosteel,2021,adjustment of energy utilization structure risks,6
16,Baosteel,2021,product substitution risks,1
16,Baosteel,2021,risk of effectively dealing with risks,1
16,Baosteel,2021,risk of preventing major risks,1
16,Baosteel,2021,risks in implementing low-carbon process throughout the whole process,0
16,Baosteel,2021,"risks in key and core technologies in high-efficiency converter smelting, direct rolling of plate blanks, fully continuous endless rolling of hot rolling, etc.",0
16,Baosteel,2022,High cost of hydrogen production and storage,1
16,Baosteel,2022,Technical challenges in scaling up hydrogen-assisted shaft furnace system,1
16,Baosteel,2022,Limited availability and high cost of hydrogen resources,1
16,Baosteel,2022,Complexity of integrating hydrogen technology into existing production processes,1
