company_id,company,year,motivators,topic
2,Acerinox,2023,Developing premium products that meet more stringent sustainability criteria,6
2,Acerinox,2023,STEPS and SDS,-1
2,Acerinox,2024,Setting objectives to reduce water consumption,14
2,Acerinox,2024,Implementing water consumption efficiency measures,14
2,Acerinox,2024,Investing in water treatment and recovery plants,14
2,Acerinox,2024,Transition - political or legal,-1
2,Acerinox,2024,Setting targets to improve carbon intensity within the framework of the Decarbonization Plan,-1
2,Acerinox,2024,Positive impacts on GHG Reduction are due to the implementation of measures to mitigate climate change,0
2,Acerinox,2024,Loss of market share due to non-compliance with CO 2 rates,-1
2,Acerinox,2024,Increase in costs due to non-compliance with CO 2 e rates,-1
2,Acerinox,2024,Increase in costs (CAPEX and OPEX) to meet emissions reduction targets,-1
2,Acerinox,2024,Integration of sustainability-related performance in incentive schemes,0
2,Acerinox,2024,Transition plan for climate change mitigation,-1
2,Acerinox,2024,"Material impacts, risks and opportunities and their interaction with strategy and business model",-1
2,Acerinox,2024,"Description of the processes to identify and assess material climate-related impacts, risks and opportunities",8
2,Acerinox,2024,Policies related to climate change mitigation and adaptation,8
2,Acerinox,2024,Actions and resources in relation to climate change policies,8
2,Acerinox,2024,Targets related to climate change mitigation and adaptation,8
2,Acerinox,2024,Energy consumption and mix,7
2,Acerinox,2024,"Gross Scopes 1, 2, 3 and Total GHG emissions",0
2,Acerinox,2024,GHG removals and GHG mitigation projects financed through carbon credits,0
2,Acerinox,2024,Internal carbon pricing,-1
2,Acerinox,2024,Anticipated financial effects from material physical and transition risks and potential climate-related opportunities,8
2,Acerinox,2024,Risk associated with the introduction of mechanisms or levies that tax carbon emissions,-1
2,Acerinox,2024,Adopting energy efficiency and emissions reduction measures,7
2,Acerinox,2024,"Indirect impact on supply chains, implying potential additional operating costs in inputs and energy prices",0
2,Acerinox,2024,Increasing the consumption of renewable electricity,13
2,Acerinox,2024,Looking into replacing natural gas with low-carbon fuels (hydrogen and biomethane),-1
2,Acerinox,2024,"Analyzing carbon capture, utilization and storage projects",-1
2,Acerinox,2024,Decrease in demand,1
2,Acerinox,2024,Setting of 2030 sustainability targets,4
2,Acerinox,2024,Changes in customer preferences,6
2,Acerinox,2024,Sustainability Master Plan - Positive Impact 360º,4
2,Acerinox,2024,Decarbonization plan and setting of carbon intensity targets,5
2,Acerinox,2024,Developing premium products that meet more stringent sustainability criteria (ECO ACX),6
2,Acerinox,2024,Stimulus measures,7
2,Acerinox,2024,Products and services,6
2,Acerinox,2024,Increased steel demand due to the development of new technologies and products for the energy transition,1
2,Acerinox,2024,Increasing demand for more sustainable products,6
2,Acerinox,2024,Sustainability Master Plan. Positive Impact 360º,4
2,Acerinox,2024,Resource efficiency,7
2,Acerinox,2024,Reduction of environmental impact,-1
2,Acerinox,2024,Improving energy efficiency,7
2,Acerinox,2024,Reduction of operating costs,7
2,Acerinox,2024,Reduced exposure to the future price of fossil fuels,-1
2,Acerinox,2024,Energy sources,7
2,Acerinox,2024,Use of renewable or low-carbon energy,13
2,Acerinox,2024,Improving business sustainability,6
3,Outokumpu,2013,Climate change (SR p. 22),8
3,Outokumpu,2013,Corporate Governance statement (AR p. 117– 118),-1
3,Outokumpu,2013,Customers (SR p. 49),9
3,Outokumpu,2013,Product properties (SR p. 6),6
3,Outokumpu,2013,Safe use of stainless (SR p. 9),1
3,Outokumpu,2013,Environmental goals and results (SR p. 15),-1
3,Outokumpu,2013,Focus on company turnaround (SR p. 36),-1
3,Outokumpu,2013,Diversity and equal rights (SR p. 38),9
3,Outokumpu,2013,Our impact on the environment (SR p. 10– 13),-1
3,Outokumpu,2013,Climate change risks (SR p. 23–24),8
3,Outokumpu,2013,Sustainable supply chain (SR p. 32),0
3,Outokumpu,2013,Biodiversity (SR p. 30),9
3,Outokumpu,2013,Our people (SR p. 34),9
3,Outokumpu,2013,Goals and results (SR p. 38),9
3,Outokumpu,2013,"Operational risks (AR, p. 124)",2
3,Outokumpu,2013,Training and development (SR p. 40),15
3,Outokumpu,2013,Local communities (SR p. 51-53),9
3,Outokumpu,2013,Material balance (SR p. 18),-1
3,Outokumpu,2013,"Emissions, effluents and waste (SR p. 28)",-1
3,Outokumpu,2013,Energy efficiency (SR p. 19),7
3,Outokumpu,2013,Review by the Board of Directors 2013 (AR p. 16),-1
3,Outokumpu,2013,CEO's review (AR p. 1),-1
3,Outokumpu,2013,Risks and uncertainties (AR p. 121–124),2
3,Outokumpu,2013,"Corporate Governance statement (AR, p. 117–118)",-1
3,Outokumpu,2014,Climate change risks (SR p. 26–28),8
3,Outokumpu,2014,Voluntary charters and other initiatives,9
3,Outokumpu,2014,Associations and federations (SR p. 56),9
3,Outokumpu,2014,Product perspective (SR p. 8),6
3,Outokumpu,2014,Material balance (SR p. 21),-1
3,Outokumpu,2014,Energy efficiency (SR p. 22),7
3,Outokumpu,2014,Memberships in associations (SR p. 56–57),9
3,Outokumpu,2014,Risks and stakeholders (SR p. 50),9
3,Outokumpu,2014,Identification and selection of stakeholders (SR p. 50),9
3,Outokumpu,2014,Approaches to stakeholder engagement (SR p. 50–59),9
3,Outokumpu,2014,Sustainable supply chain (SR p. 36),0
3,Outokumpu,2014,Communication and cooperation (SR p. 46),9
3,Outokumpu,2014,Investors and analysts (SR p. 53),9
3,Outokumpu,2014,Local communities (SR p. 54),9
3,Outokumpu,2014,Climate change (SR p. 25),8
3,Outokumpu,2014,Environmental goals and results (SR p. 14–15),-1
3,Outokumpu,2014,Corporate governance statement (AR p. 102– 104),-1
3,Outokumpu,2014,"Public sector, sponsoring and NGOs (SR p. 58), Shares and shareholders (AR p. 27)",-1
3,Outokumpu,2014,"CEO's foreword (SR p. 1), Compliance (SR p. 45)",2
3,Outokumpu,2014,Focus on material issues (SR p. 62),-1
3,Outokumpu,2014,Local communities (SR p. 54–55),9
3,Outokumpu,2014,Corporate governance statement (AR p. 103),-1
3,Outokumpu,2023,Decarbonizing across the value chain,5
3,Outokumpu,2023,Minimizing impacts on the environment,-1
3,Outokumpu,2023,Accelerating the circular economy,14
3,Outokumpu,2023,Fostering a sustainable supply chain,0
3,Outokumpu,2023,Team work towards our targets,11
3,Outokumpu,2023,Always working safely,2
3,Outokumpu,2024,Competitive advantage in low-carbon stainless steel,1
3,Outokumpu,2024,Nature of its key activity (energy-intensive),7
7,Celsa,2020,Pressure from the European Union's deadline for net-zero targets,11
7,Celsa,2020,Commitment to being a benchmark for the sector,4
7,Celsa,2020,Opportunity to be Net Positive Carbon by 2040,3
7,Celsa,2020,Commitment to successfully complete ambitious decarbonisation milestones,5
7,Celsa,2020,Pressure to reduce CO2 emissions by 55% in 2025,0
7,Celsa,2020,Commitment to increasing energy efficiency by 30%,7
7,Celsa,2020,Commitment to achieving zero residue,11
7,Celsa,2020,Commitment to being a company more committed to society and the planet,4
7,Celsa,2020,Commitment to building a company for future generations,4
7,Celsa,2023,Compliance with current regulations and national/international frameworks,2
7,Celsa,2023,Firm commitment to ethics and transparency of operations,2
7,Celsa,2023,Integrity,4
7,Celsa,2023,Transparent disclosure of information,2
7,Celsa,2023,Development of applicable laws and regulations,2
7,Celsa,2023,Responsibility to comply with existing regulations and global frameworks,2
7,Celsa,2023,Corporate identity,-1
7,Celsa,2023,Vision of sustainability,-1
7,Celsa,2023,Business practices,-1
7,Celsa,2023,Governance aspects,2
7,Celsa,2023,Social aspects,2
7,Celsa,2023,Environmental aspects,2
7,Celsa,2023,Societal aspects,2
1,ArcelorMittal,2013,Commitment to having all steel operations certified to internationally recognised environmental management systems,1
1,ArcelorMittal,2013,Pressure to consider environmental impacts over the entire lifetime of the steel produced,1
1,ArcelorMittal,2013,Opportunity to maximise environmental benefits through focused investment,0
1,ArcelorMittal,2014,"A world that is still recovering from the after-effects of a major economic crisis, where demand for steel reduced significantly in the developed nations and has still in some countries not reached pre-crisis levels;",1
1,ArcelorMittal,2014,"A world where China has emerged as the largest producer and consumer and, increasingly, a major exporter;",1
1,ArcelorMittal,2014,A more competitive world with an increasing focus on sustainability where our customers’ demands for more sophisticated grades of steel are increasing;,1
1,ArcelorMittal,2014,Regulations relating to carbon emissions;,2
1,ArcelorMittal,2014,Geo-political realities driving energy policy and supplies;,-1
1,ArcelorMittal,2014,Lower carbon future;,12
1,ArcelorMittal,2014,"Energy usage, thereby reducing both CO2 emissions and costs;",7
1,ArcelorMittal,2014,Managing and monitoring the non-financial aspects of our business at the local level;,2
1,ArcelorMittal,2014,Tracking stakeholder expectations and long-term global sustainability trends;,-1
1,ArcelorMittal,2014,Responding effectively and transparently to global sustainability trends;,4
1,ArcelorMittal,2014,Energy usage,7
1,ArcelorMittal,2016,Stakeholder expectations on climate change,-1
1,ArcelorMittal,2016,Building resilience in our communities to tackle climate change,-1
1,ArcelorMittal,2016,Bringing in more economic drivers to reduce GHG emissions,0
1,ArcelorMittal,2016,Building capacity for conservation efforts to reduce GHG emissions,0
1,ArcelorMittal,2016,STEM education to develop skills for a low-carbon future,12
1,ArcelorMittal,2016,Working with partners to achieve decarbonisation goals,5
1,ArcelorMittal,2016,Need to be a strong corporate citizen in addressing climate change,-1
1,ArcelorMittal,2016,Return value to stakeholders through decarbonisation efforts,5
1,ArcelorMittal,2016,Long-term partnerships to address climate change,5
1,ArcelorMittal,2016,Leverage partnerships to return value to stakeholders in a low-carbon future,5
1,ArcelorMittal,2018,The Paris Agreement,5
1,ArcelorMittal,2018,Policy support,-1
1,ArcelorMittal,2018,Renewable energy technology development,13
1,ArcelorMittal,2018,Public investment and production subsidies,5
1,ArcelorMittal,2018,Priority access to affordable renewable energy,13
1,ArcelorMittal,2018,Funding to support technological development,0
1,ArcelorMittal,2018,Green border adjustment in Europe,-1
1,ArcelorMittal,2018,EU Emissions Trading Scheme,-1
1,ArcelorMittal,2018,Reputational risks,2
1,ArcelorMittal,2018,Regulatory risks,2
1,ArcelorMittal,2018,The need to reduce carbon footprint in line with the Paris Agreement,5
1,ArcelorMittal,2018,The need to reform the way primary steel is made to reduce emissions,1
1,ArcelorMittal,2018,The challenge of reducing the carbon footprint of steelmaking,1
1,ArcelorMittal,2018,The need to achieve drastic reductions of carbon emissions,0
1,ArcelorMittal,2018,The need to transition to low-carbon steelmaking,1
1,ArcelorMittal,2018,The need to develop research and development programs to reduce emissions,12
1,ArcelorMittal,2018,The need to follow the state of knowledge on climate change closely,8
1,ArcelorMittal,2019,Technology makes encouraging progress and is potentially ready for significant deployment within 10-20 years,0
1,ArcelorMittal,2019,Access to sufficient and affordable clean energy in supportive countries/regions,5
1,ArcelorMittal,2019,Regions with more active climate legislation ensure,8
1,ArcelorMittal,2019,"Even in jurisdictions actively providing financial support to develop and roll out low-emissions technologies, the steel industry will need further support",1
1,ArcelorMittal,2019,"Without effective mechanisms to offset the structurally higher operating costs of deploying these technologies, and affordable access to the clean energy they need, the steel industry will be unable to make the necessary shift needed to meet the goals of the Paris Agreement",1
1,ArcelorMittal,2019,The Company is exposed to the risk of frameworks and regulations being adopted that are ill-adapted to its operations,2
1,ArcelorMittal,2019,"The European Commission has presented a package of measures to implement key actions with respect to its sustainable finance plan, including a proposed regulation to create a unified classification system (“taxonomy”) on what can be considered an environmentally sustainable economic activity",-1
1,ArcelorMittal,2019,"If the metrics adopted in the taxonomy are not appropriate for the Company or if investors begin to view investments in steel and mining as undesirable, it may become more difficult and/or more expensive for the Company to obtain financing",1
1,ArcelorMittal,2019,The world needs to find a new way of doing things that enables further economic and social development while minimising environmental damage,4
1,ArcelorMittal,2019,Success in reducing the carbon footprint of steel requires finding new ways to make steel in a less emissions-intensive process,1
1,ArcelorMittal,2019,"The industrialisation of the world has been powered by fossil fuels, and the steel industry has involved using coal-based products, such as coke, to reduce iron ore in the blast furnace",1
1,ArcelorMittal,2019,The large volumes of steel produced globally mean that the industry emits over three gigatons of CO 2 annually,1
1,ArcelorMittal,2019,"We are committed to the objectives of the Paris Agreement and I want to reassure our stakeholders that we will do our best to contribute effectively to a low-carbon world and, in doing so, help them manage their own risks and ambitions",5
1,ArcelorMittal,2019,We need to develop breakthrough low-emissions steelmaking technologies,1
1,ArcelorMittal,2019,"We are working on the technologies for several potential pathways including circular carbon and clean power, and these underpin our ambition to significantly reduce our carbon footprint by 2050",12
1,ArcelorMittal,2019,"Steel is integral to the fabric of modern society, and a key enabler of many of the new technologies and clean infrastructure solutions that will deliver the circular economy of the future",1
1,ArcelorMittal,2019,"Already, when used in a range of today’s sustainable applications, such as offshore wind turbines, lightweight electric vehicles and low-energy buildings, steel achieves emissions reductions that are estimated to outweigh emissions associated with its production by a ratio of six to one",1
1,ArcelorMittal,2020,Reassuring customers on sustainability performance,6
1,ArcelorMittal,2020,Addressing the climate challenge,8
1,ArcelorMittal,2020,Reaching net zero by 2050,11
1,ArcelorMittal,2020,Doubling the number of women managers by 2030,15
1,ArcelorMittal,2020,Constructive government policies for a level playing field,-1
1,ArcelorMittal,2020,Right market conditions to create a level playing field between steelmakers,1
1,ArcelorMittal,2020,Supportive policy for a low-emission steel industry,1
1,ArcelorMittal,2020,Opportunities for steel to be the material of choice for a low-carbon world,1
1,ArcelorMittal,2020,Opportunities for infrastructure required for the transition to a low-carbon economy,12
1,ArcelorMittal,2020,Recognition by CDP for strong performance in corporate transparency and action on climate change,-1
1,ArcelorMittal,2020,Pressure to intensify efforts to decarbonise as an industry,5
1,ArcelorMittal,2020,Pressure to achieve net zero targets,11
1,ArcelorMittal,2020,Pressure to make difficult economic decisions due to harsh business environment of Covid-19,7
1,ArcelorMittal,2021,New Group target of a 25% reduction in CO 2 e emissions intensity by 2030,0
1,ArcelorMittal,2021,$565 million allocated to 40 projects with environmental benefits,0
1,ArcelorMittal,2021,XCarb TM steel transformation programme,1
1,ArcelorMittal,2021,Government support for decarbonization technologies,5
1,ArcelorMittal,2021,Effective policies to secure a level playing field,-1
1,ArcelorMittal,2021,Decarbonization technologies becoming more mature and efficient,-1
1,ArcelorMittal,2021,Public funding covering 50% of the total cost of decarbonization,5
1,ArcelorMittal,2021,Renewable energy certificates,13
1,ArcelorMittal,2021,Direct power purchase agreements (PPA) with suppliers from renewables projects,13
1,ArcelorMittal,2021,"Carbon capture, utilisation and storage (CCUS) infrastructure expansion",-1
1,ArcelorMittal,2021,Climate-friendly policies in Europe and other jurisdictions,8
1,ArcelorMittal,2021,Introduction of a carbon price,-1
1,ArcelorMittal,2021,Stringent GHG reduction requirements,0
1,ArcelorMittal,2021,Net-zero targets and climate ambition,11
1,ArcelorMittal,2021,Climate Action Report 2 aligned with TCFD and Climate Action 100+,0
1,ArcelorMittal,2021,ResponsibleSteel TM certification,1
1,ArcelorMittal,2021,Commitment to IRMA,11
1,ArcelorMittal,2021,Commitment to avoid “carbon leakage”,0
1,ArcelorMittal,2021,Compensation for the significantly higher costs of decarbonization,5
1,ArcelorMittal,2021,Fair and competitive landscape for companies during the transition period,-1
1,ArcelorMittal,2021,"Support from host countries, first and foremost from the European Union and its member states",-1
1,ArcelorMittal,2021,"Support from local communities through employment, procurement, taxation and sustainable development initiatives",-1
1,ArcelorMittal,2021,Partnership approach with local communities to address issues affecting them and their environment,5
1,ArcelorMittal,2021,Decarbonization roadmap to net zero,5
1,ArcelorMittal,2021,Five levers to increase the amount of clean electricity consumed,13
1,ArcelorMittal,2021,Purchasing renewable energy certificates and direct power purchase agreements (PPA) with suppliers from renewables projects,13
1,ArcelorMittal,2022,Spiking energy prices,-1
1,ArcelorMittal,2022,Potential energy shortages,7
1,ArcelorMittal,2022,Increased risk of financial exposure,2
1,ArcelorMittal,2022,More stringent GHG reduction requirements,0
1,ArcelorMittal,2022,Carbon prices,-1
1,ArcelorMittal,2022,Introduction of effective policies to secure a level playing field,-1
1,ArcelorMittal,2022,Decarbonization technologies becoming more mature and efficient,-1
1,ArcelorMittal,2022,Public funding covering 50% of the total cost of decarbonization,5
1,ArcelorMittal,2022,Governmental and societal support for decarbonization,5
1,ArcelorMittal,2022,Regulatory environment and business environment evolving,2
1,ArcelorMittal,2022,Predictability of the regulatory environment and business environment,2
1,ArcelorMittal,2022,Inflation Reduction Act in the United States,7
1,ArcelorMittal,2022,EU net Zero Industry Act,11
1,ArcelorMittal,2022,Renewable energy becoming more competitive,13
1,ArcelorMittal,2022,Green hydrogen becoming commercially viable,-1
1,ArcelorMittal,2022,CCS becoming commercially viable,-1
1,ArcelorMittal,2022,Climate-friendly policies in other regions,8
1,ArcelorMittal,2022,Net-zero targets,11
1,ArcelorMittal,2022,Fossil fuel transition,-1
1,ArcelorMittal,2022,Net-zero economy,11
1,ArcelorMittal,2022,GHG reduction requirements,0
1,ArcelorMittal,2022,Carbon prices being introduced and increased,-1
1,ArcelorMittal,2023,"Decrease of steel demand compared to business as usual, due to increased material efficiency and product lifetimes, and increased circularity.",1
1,ArcelorMittal,2023,"Transition to a low-carbon economy brings opportunities for growth in emerging economies like India, due to the expansion of their infrastructure, and in key markets associated with clean technologies (e.g. wind turbines, solar panels and electric vehicles).",12
1,ArcelorMittal,2023,"Restrictions on clean energy scalability, which can have significant impacts on our decarbonisation costs in some regions.",5
1,ArcelorMittal,2023,Climate and industrial policies between regions not being aligned may lead to carbon leakage.,8
1,ArcelorMittal,2023,Increasing shareholder activism and/or litigation in relation to sustainability matters.,-1
1,ArcelorMittal,2023,"Economic developments, uncertainties over the pace of transition to low-emission technologies, political and environmental actions that will be taken to meet the carbon reduction goals, regulatory changes and emissions activity arising from climate-related matters.",12
1,ArcelorMittal,2023,Competition from other materials and alternative steel-based technologies could reduce market prices and demand for steel products and thereby reduce ArcelorMittal’s cash flows and profitability.,1
1,ArcelorMittal,2023,"Low emissions technologies will become more competitive over time as more stringent GHG reduction requirements and/or carbon prices are introduced and increased in each jurisdiction, alongside the introduction of effective policies to secure a level playing field, and the decarbonization technologies themselves become more mature and efficient.",-1
1,ArcelorMittal,2023,"A fair competitive landscape that accounts for the global nature of the steel market, ensuring domestic production and imports are subject to equivalent GHG reduction regulations and incentives, such as a fairly and internationally applied Emissions Trading Scheme (ETS).",1
1,ArcelorMittal,2023,Financial support to innovate and make long-term investments and neutralize the higher operating costs of low and zero carbon-emissions steelmaking.,1
1,ArcelorMittal,2023,Access to sufficient clean energies at affordable price levels.,5
1,ArcelorMittal,2023,Incentives to encourage the consumption of low- and zero-carbon emissions steel over higher carbon emissions steel.,1
1,ArcelorMittal,2023,Creation of clear definitions for low-carbon emissions physical steel to support the steel industry in its transition to net-zero by 2050.,1
1,ArcelorMittal,2023,Public funding covers 50% of the total cost of decarbonization (capital expenditures and higher operating expenses) so that the Company and industry are not rendered uncompetitive during this transition period.,5
1,ArcelorMittal,2024,Uncertainties over the pace of transition to low-emission technologies,12
1,ArcelorMittal,2024,Political and environmental actions to meet carbon reduction goals,8
1,ArcelorMittal,2024,Regulatory changes and emissions activity arising from climate-related matters,2
1,ArcelorMittal,2024,Need for further support from host countries through more supportive policies,-1
1,ArcelorMittal,2024,Requirement for a level playing field to maintain competitiveness,-1
1,ArcelorMittal,2024,"Need to avoid ""carbon leakage"" and provide compensation for higher costs",-1
1,ArcelorMittal,2024,Introduction of carbon prices in each jurisdiction,-1
1,ArcelorMittal,2024,Introduction of effective policies to secure a level playing field,-1
1,ArcelorMittal,2024,Development of low emissions technologies,12
1,ArcelorMittal,2024,Implementation of a cost on carbon in each jurisdiction,-1
1,ArcelorMittal,2024,Need for more stringent global GHG reduction requirements,0
1,ArcelorMittal,2024,Implications of the net-zero path on future taxable profits expectations,11
1,ArcelorMittal,2024,Costs of green hydrogen and its evolution over time,-1
1,ArcelorMittal,2024,Construction of DRI and EAF facilities,13
1,ArcelorMittal,2024,Development of CCUS infrastructure,-1
1,ArcelorMittal,2024,Timing of the introduction of GHG reduction requirements and supportive policies,0
1,ArcelorMittal,2024,Achievement of carbon neutrality by 2050,3
1,ArcelorMittal,2024,Costs of green hydrogen,-1
1,ArcelorMittal,2024,Evolution of green hydrogen towards becoming a viable fuel source,-1
1,ArcelorMittal,2024,Natural gas-based DRI production in Europe not yet being a competitive interim solution,-1
1,ArcelorMittal,2024,Introduction of GHG reduction requirements and supportive policies in applicable jurisdictions,0
1,ArcelorMittal,2025,Pressure from science to adapt to the pace of change demanded by climate crisis.,8
1,ArcelorMittal,2025,Pressure from markets to remain aligned with decarbonisation.,5
1,ArcelorMittal,2025,Pressure from society to act on climate change.,8
1,ArcelorMittal,2025,Risk to future relevance if ArcelorMittal does not lead the transition.,1
1,ArcelorMittal,2025,Risk that delaying climate action may prove more costly than committing to it.,0
1,ArcelorMittal,2025,"Opportunity for ArcelorMittal to lead the transition with its scale, capital, and technical expertise.",1
1,ArcelorMittal,2025,Opportunity for investment and innovation to drive decarbonisation in steel.,1
1,ArcelorMittal,2025,Commitment to long-term competitiveness in a decarbonising world.,5
1,ArcelorMittal,2025,Commitment to strategic vision for economic viability in a decarbonising world.,5
1,ArcelorMittal,2025,Incentive to act on climate change to avoid worsening the state of the climate and the planet.,0
1,ArcelorMittal,2025,Incentive to move forward with decarbonisation to remain competitive.,5
15,NipponSteel,2014,Regulatory reforms,2
15,NipponSteel,2014,Improvements,0
15,NipponSteel,2014,Targets and achievements,11
15,NipponSteel,2014,Promotion of global warming countermeasures,-1
15,NipponSteel,2014,Pressure to prevent environmental accidents,2
15,NipponSteel,2014,Development of environmental and energy solutions,12
15,NipponSteel,2014,Promotion of environmental relation activities,-1
15,NipponSteel,2014,Enhancement and promotion of environmental management,-1
15,NipponSteel,2014,Creation of a low-carbon society,12
15,NipponSteel,2014,Action plans for a low-carbon society,12
15,NipponSteel,2017,Adoption of the Paris Agreement,5
15,NipponSteel,2017,Plan to cut greenhouse gas emissions in Japan,0
15,NipponSteel,2017,Theoretically infinite recycling of steel,1
