company_id,company,year,motivators,topic
8,Voestalpine,2023,Driver to improve supply chain resilience and adaptability through sustainability practices,0
8,Voestalpine,2023,Pressure from industry associations to meet decarbonisation standards,5
8,Voestalpine,2023,Incentive to develop and implement sustainable water management practices,0
8,Voestalpine,2024,Climate and Environmental Protection,8
8,Voestalpine,2024,Sustainability in the Supply Chain,0
8,Voestalpine,2024,Research and Development,0
8,Voestalpine,2024,Sustainable Products and Services,6
8,Voestalpine,2024,Employees: Inside,15
8,Voestalpine,2024,Health & safety,2
8,Voestalpine,2024,New technologies in steel production,1
8,Voestalpine,2024,R&e focus Sustainability,6
8,Voestalpine,2024,Sustainable products,6
8,Voestalpine,2024,ResponsibleSteel,1
8,Voestalpine,2024,UN Global Compact – The 10 Principles,-1
8,Voestalpine,2024,Sustainable Development Goals,4
14,Feralpi,2018,Pressure from regulatory bodies to reduce GHG emissions,2
14,Feralpi,2018,Commitment to net-zero targets,11
14,Feralpi,2018,Opportunity to reduce costs through energy efficiency,7
14,Feralpi,2018,Driver to transition away from fossil fuels,-1
14,Feralpi,2018,Incentive to invest in renewable energy sources,13
14,Feralpi,2018,Pressure from investors to meet decarbonisation goals,5
14,Feralpi,2018,Commitment to reduce Scope 2 GHG emissions,0
14,Feralpi,2018,Opportunity to improve brand reputation through sustainability efforts,-1
14,Feralpi,2018,Driver to reduce indirect (Scope 3) GHG emissions,-1
14,Feralpi,2018,Incentive to comply with environmental regulations,0
14,Feralpi,2018,Pressure from customers to adopt sustainable practices,6
14,Feralpi,2018,Commitment to reduce atmospheric emissions,0
14,Feralpi,2018,Opportunity to access new markets through sustainable products,6
14,Feralpi,2018,Driver to reduce GHG emissions intensity,-1
14,Feralpi,2018,Incentive to reduce waste and by-products,0
14,Feralpi,2018,Pressure from stakeholders to meet decarbonisation targets,5
14,Feralpi,2018,Commitment to environmental responsibility policies,0
14,Feralpi,2018,"Opportunity to reduce nitrogen oxides (NOx), sulfur oxides (SOx), and other significant air emissions",0
14,Feralpi,2018,Driver to improve environmental management practices,-1
14,Feralpi,2018,Incentive to reduce water discharged by quality and destination,0
14,Feralpi,2018,Pressure from governments to meet decarbonisation goals,5
14,Feralpi,2018,Commitment to reduce waste by type and disposal method,0
14,Feralpi,2018,Opportunity to reduce significant spills,2
14,Feralpi,2018,Driver to reduce transport of hazardous waste,-1
14,Feralpi,2018,Incentive to improve environmental compliance,0
14,Feralpi,2021,Development of renewable energy production facilities,13
14,Feralpi,2021,Reduction of direct emissions through plant investments,0
14,Feralpi,2021,Enhancement of energy efficiency interventions,7
14,Feralpi,2021,Strengthening of economic sustainability by obtaining white certificates,7
14,Feralpi,2021,Integration of risk management related to the application of Emission Trading,-1
14,Feralpi,2021,Investment in renewable energy production facilities,13
14,Feralpi,2021,Use of recovered materials from other production cycles as raw material,14
14,Feralpi,2021,Valorisation of production residues within the production cycle or externally,14
14,Feralpi,2021,Measures to reduce direct greenhouse gas emissions and other air emissions,0
14,Feralpi,2021,Energy efficiency measures,7
14,Feralpi,2021,Measures to support renewable energy,13
14,Feralpi,2021,Measures for the development of sustainable mobility,-1
14,Feralpi,2021,Advanced energy monitoring,7
14,Feralpi,2021,Accounting of CO2 emissions in line with the methodology and guidelines of ISO 14064,0
14,Feralpi,2022,Commitment to Research & Development,0
14,Feralpi,2022,Decarbonisation Goal,5
14,Feralpi,2022,Climate Strategy and Science-Based Targets,8
14,Feralpi,2022,Feralpi Power On,7
14,Feralpi,2022,Organisation and Product Carbon Footprint,-1
14,Feralpi,2022,Energy efficiency measures and reduction of green-house gas and other emissions,7
14,Feralpi,2022,Circularity and zero-waste: material and energy management and valorisation,14
14,Feralpi,2022,Measures to improve circularity,14
14,Feralpi,2022,Governance and management of environmental aspects,2
14,Feralpi,2022,Environmental Management Policies and Systems,-1
14,Feralpi,2022,Science-Based Targets,-1
14,Feralpi,2023,Purchase of electricity with a contract linked to a specific renewable generation plant,13
14,Feralpi,2023,Purchasing “tactical” Green PPA / GdO,6
14,Feralpi,2023,Guarantees of Origin: Purchase of spendable credits to certify renewable electricity consumption,13
14,Feralpi,2023,Securing the supply chain,0
14,Feralpi,2023,Turning sustainability into an advantage,6
14,Feralpi,2023,Excelling in efficiency and innovation,7
14,Feralpi,2023,Growing beyond the current domains,0
14,Feralpi,2023,Expanding as a “one-stop shop”,6
14,Feralpi,2023,Decarbonising the country’s energy mix,5
14,Feralpi,2023,Electricity supply from market/grid whose emissions are decreasing over time due to the decarbonisation of the country mix,5
14,Feralpi,2023,Set ambitious CO 2 emission reduction targets,0
14,Feralpi,2023,Gaining market share in neighbouring countries for construction steels,1
14,Feralpi,2023,Gaining market share in high-margin applications for special steels,1
14,Feralpi,2023,Responding to customer needs with a flexible and comprehensive product offering,6
14,Feralpi,2023,"Further optimising the cost base with improvements in productivity, energy efficiency, and intra-organisation synergies",7
14,Feralpi,2023,Contribute to change in the steel sector by leveraging decarbonisation and digitalisation,1
14,Feralpi,2023,Ensure business continuity by enhancing the company’s ability to manage crises,2
14,Feralpi,2023,Innovate for the future of production by investing in state-of-the-art production processes,0
14,Feralpi,2023,Foster the ecological transition by internalising the challenges of decarbonisation,5
14,Feralpi,2024,Pressure from ongoing military conflicts and global political shifts to achieve a real transformation.,-1
14,Feralpi,2024,"Commitment to DEI (Diversity, Equity and Inclusion) activities to promote the inclusion of female staff in a traditionally male-dominated sector.",15
14,Feralpi,2024,"Need for a more cohesive, responsive, and operational Europe to counter global giants like the USA and China.",-1
14,Feralpi,2024,"Commitment to collaboration with stakeholders, from employees to participants in value chains, for genuine transformation.",9
14,Feralpi,2024,Pressure to establish conditions for a united Europe to act effectively.,-1
14,Feralpi,2024,Commitment to clear goals and steadfast pursuit of them.,4
14,Feralpi,2024,Commitment to efficient technologies and processes with reduced environmental impact.,-1
14,Feralpi,2024,Commitment to providing a broad and high-quality range of offerings to face challenges ahead.,-1
14,Feralpi,2024,Commitment to embodying a social role that values people and respects their individuality.,4
14,Feralpi,2024,Opportunity to accelerate and strengthen DEI activities.,15
14,Feralpi,2024,Commitment to maintaining engagement with stakeholders for genuine transformation.,9
14,Feralpi,2024,Commitment to establishing the conditions to act as a united player capable of countering global giants.,-1
4,Salzgitter,2017,Cost-effectiveness,7
4,Salzgitter,2017,Preservation of jobs,7
4,Salzgitter,2017,Climate protection,8
4,Salzgitter,2017,Observance of human rights,2
4,Salzgitter,2017,Global framework for climate protection,8
4,Salzgitter,2017,Pressure from emissions trading,-1
4,Salzgitter,2017,Amendments to emissions trading,-1
4,Salzgitter,2017,EU regulations on steel imports,1
4,Salzgitter,2018,Economic viability,7
4,Salzgitter,2018,Preservation of jobs,7
4,Salzgitter,2018,Global framework for climate protection,8
4,Salzgitter,2018,Global framework for human rights,8
4,Salzgitter,2019,Unilateral burdens from energy and climate policies,8
4,Salzgitter,2019,Investments in the billion range for achieving CO 2 reduction targets,0
4,Salzgitter,2019,Cheaper but more CO 2 -intensive steel imports,1
4,Salzgitter,2019,Deindustrialization with all its ensuing fallout,5
4,Salzgitter,2019,Ensuring economic viability and preservation of jobs,7
4,Salzgitter,2019,Global framework for climate protection,8
4,Salzgitter,2019,Politicians' responsibility to create future-proof framework conditions,-1
4,Salzgitter,2019,Politicians' onus to shape the future,-1
4,Salzgitter,2019,Transition away from coal to other sources of energy in steel production,1
4,Salzgitter,2020,Economic viability,7
4,Salzgitter,2020,Preservation of jobs,7
4,Salzgitter,2020,European Green New Deal,-1
4,Salzgitter,2020,Emissions trading,-1
4,Salzgitter,2020,Climate protection,8
4,Salzgitter,2022,Strong interest of customers in low carbon steel,1
4,Salzgitter,2022,Possible surplus demand for green steel,1
4,Salzgitter,2022,Customers willing to pay a premium for green steel products,1
4,Salzgitter,2022,Ongoing monitoring and analysis of relevant developments,0
4,Salzgitter,2022,Group and management structure aligned for efficient and effective leveraging of potential,-1
4,Salzgitter,2022,Partnering agreements with customers for low carbon steel supply,1
4,Salzgitter,2022,Customers' need to reduce carbon footprint in upstream value chain (Scope 3 emissions),-1
4,Salzgitter,2022,Customers' desire to achieve their own sustainability goals,6
4,Salzgitter,2022,Premium purchase price for green steel products compared to lower production costs for high-carbon steel products,1
4,Salzgitter,2023,Potential for generating higher margins in the newly emerging market for green steel.,1
4,Salzgitter,2023,Opportunity to lower carbon emissions (Scope 3) for customers.,-1
4,Salzgitter,2023,Steady expansion of trade with low-carbon steel.,1
4,Salzgitter,2023,Continuous improvement in the recyclability of machines and products.,14
4,Salzgitter,2023,"Savings potential of around 600,000 t of carbon per year from employee-submitted ideas.",-1
4,Salzgitter,2023,Meeting short-term Science Based Target through groupwide decarbonization path.,5
4,Salzgitter,2023,"Incentive to submit ideas for reducing carbon emissions through the ""Decarb Award"".",-1
4,Salzgitter,2023,"Opportunity to participate in the company's growth through the ""Decarb Award"".",4
4,Salzgitter,2023,"Annual changing priorities from the three areas of ecological, social and entrepreneurial sustainability through the ""Change Award"" series.",4
4,Salzgitter,2023,"Information on current issues in the Group through Intranet, printed matter, video blogs, and podcasts.",-1
4,Salzgitter,2023,"Regular information on the Group's current situation and future development through the ""InSZights"" series.",-1
4,Salzgitter,2023,Collaboration agreements and memoranda of understanding with research partners and suppliers.,9
4,Salzgitter,2023,Exchange of know-how on new technologies and production techniques.,0
4,Salzgitter,2023,Joint information events and regional projects on reducing carbon in the supply chain.,0
4,Salzgitter,2023,Innovative solutions in the area of resource efficiency.,7
4,Salzgitter,2023,Reducing carbon in the supply chain.,0
4,Salzgitter,2023,Potential for reducing carbon emissions through the development of SALCOS.,1
4,Salzgitter,2024,Increasing demands of society,6
4,Salzgitter,2024,Impact of emissions trading on individual cash-generating units,-1
4,Salzgitter,2024,Expected price development of emission certificates,-1
4,Salzgitter,2024,Changes in the political framework,-1
4,Salzgitter,2024,Industry-specific market expectations,9
4,Salzgitter,2024,Steady rise in the proportion of renewable electricity in electricity purchased,13
4,Salzgitter,2024,Permanent reduction in Scope 2 CO 2 e emissions,0
4,Salzgitter,2024,Significant cut in Scope 1 emissions from the production of carbon-reduced steel from the SALCOS® route,1
4,Salzgitter,2024,Constant expansion of the use of renewable energies,13
4,Salzgitter,2024,Original and current budgeting for decarbonization,5
4,Salzgitter,2024,"SALCOS®: sustainable, low carbon steel production",1
4,Salzgitter,2024,Company development and corporate strategy,4
4,Salzgitter,2024,Climate scenarios in the resilience analysis,8
4,Salzgitter,2024,Saving process-related CO 2 e emissions,-1
4,Salzgitter,2024,Boosting the share of electricity from renewable sources,13
4,Salzgitter,2024,Optimizing production processes and raising energy efficiency,0
4,Salzgitter,2024,Transition plan for decarbonization,5
4,Salzgitter,2024,50% reduction in Scope 1 and 2 CO 2 e emissions from the Group companies,0
4,Salzgitter,2024,100% renewable electricity from external sources,13
4,Salzgitter,2024,Compliance with national laws and official requirements in relation to the release of pollutants,2
4,Salzgitter,2024,Expansion of scrap recycling and use of scrap from secondary raw materials,14
4,Salzgitter,2024,50% reduction in accidents,2
4,Salzgitter,2024,Promotion of employee health and safety,-1
4,Salzgitter,2024,Provision of qualification and growth opportunities to preserve employees’ employability,15
4,Salzgitter,2024,Early identification of the need for skilled workers and managers,15
4,Salzgitter,2024,Protecting the health and safety of all suppliers and partner companies involved with our companies,2
16,Baosteel,2014,Pressure from new Law on Work Safety,2
16,Baosteel,2014,Pressure from new Law of Environmental Protection,2
16,Baosteel,2014,Opportunity for institutional and systemic innovation,0
16,Baosteel,2014,Opportunity for technology innovation,0
16,Baosteel,2014,Commitment to constructing ecological civilization,-1
16,Baosteel,2018,Pressure from more stringent environmental protection measures,2
16,Baosteel,2018,Opportunity from industrial service transformation,-1
16,Baosteel,2018,Pressure from supply-side structural reform,2
16,Baosteel,2018,Opportunity from material demand upgrading,1
16,Baosteel,2021,"Building a low-cost, differentiated and highly efficient manufacturing capacity through comprehensive benchmarking.",0
16,Baosteel,2021,Improving process interface efficiency and the cost of iron and steel.,1
16,Baosteel,2021,"Maintaining continuous, stable and low-cost production of the whole process of iron and steel.",1
16,Baosteel,2021,Investigating the optimized production organization mode of coordination among four bases.,0
16,Baosteel,2021,Constantly optimizing the division of the production line of different varieties.,0
16,Baosteel,2021,Improving the ability to implement low-carbon process throughout the whole process.,-1
16,Baosteel,2021,"Making major progress in key and core technologies in high-efficiency converter smelting, direct rolling of plate blanks, fully continuous endless rolling of hot rolling, etc.",1
16,Baosteel,2021,Implementing carbon peaking and carbon neutrality.,3
16,Baosteel,2021,Enhancing policy analysis.,-1
16,Baosteel,2021,Strengthening the study of macro environment and industrial trends.,-1
16,Baosteel,2021,Enhancing the capacity to effectively deal with risks.,2
16,Baosteel,2021,Effectively preventing major risks.,2
16,Baosteel,2021,Exploring and mastering core technologies of green and low-carbon metallurgy.,1
16,Baosteel,2021,Conducting life cycle assessment (LCA) to carry out green design of iron and steel products.,1
16,Baosteel,2021,Improving product performance.,6
16,Baosteel,2021,Realizing green use of product.,6
16,Baosteel,2021,Strengthening the cooperation between upstream and downstream partners.,9
16,Baosteel,2021,Building a high-quality steel ecosystem.,1
16,Baosteel,2021,Scaling up on ESG issues in supplier entry and assessment.,0
16,Baosteel,2021,Fully evaluating sustainability performance.,6
16,Baosteel,2021,Granting green products and green manufacturing products priority.,6
16,Baosteel,2021,Establishing a “low-carbon first” guideline.,12
16,Baosteel,2021,Continuously building a green supply chain.,0
16,Baosteel,2021,Cultivating innovation capacity.,0
16,Baosteel,2021,"Actively developing and deploying advanced technologies of manufacturing, energy-conservation and environmental protection.",0
16,Baosteel,2021,Improving efficiency through smart manufacturing.,0
16,Baosteel,2021,Reducing carbon emissions through green and low-carbon chain.,12
16,Baosteel,2021,Implementing environmentally friendly practices.,-1
16,Baosteel,2021,Developing high-end products that reached the world's advanced level.,6
16,Baosteel,2021,Implementing carbon control.,-1
16,Baosteel,2021,Implementing ultra-low emission.,-1
16,Baosteel,2021,Implementing M&A in the iron and steel industry.,1
16,Baosteel,2022,Pressure from urban transformation and innovation,-1
16,Baosteel,2022,Opportunity to promote regional ecology co-construction,-1
16,Baosteel,2022,Commitment to constantly raise the level of green manufacturing,-1
16,Baosteel,2022,Incentive to improve regional environmental quality,0
16,Baosteel,2022,Driver for the development of urban industries,-1
16,Baosteel,2022,Commitment to achieve positive interaction between enterprises and society,4
16,Baosteel,2022,Opportunity to assist in the development of urban industries through technology and resource sharing,-1
16,Baosteel,2022,Pressure from the current situation of urban resources and environment,-1
16,Baosteel,2022,Commitment to adhere to the direction of high-quality development,4
16,Baosteel,2022,Incentive to become a world-class steel enterprise,1
16,Baosteel,2022,Commitment to carry out green transformation,-1
16,Baosteel,2022,Opportunity to write a new chapter in the new era of steel serving the country and becoming a strong steel country,1
16,Baosteel,2022,Pressure from the development requirements,-1
16,Baosteel,2022,"Commitment to deepen the management mode of ""one company with multiple bases""",4
16,Baosteel,2024,International geopolitical conflicts and trade tensions,1
16,Baosteel,2024,Imbalance between supply and demand in the steel industry,1
16,Baosteel,2024,Risks in the construction and operation of domestic and overseas investment projects,2
16,Baosteel,2024,Green and low-carbon transformation,12
16,Baosteel,2024,Safety and environmental compliance,2
16,Baosteel,2024,Weakening product differentiation,6
16,Baosteel,2024,Capacity governance,2
16,Baosteel,2024,Green and low-carbon development,12
16,Baosteel,2024,Driving steel consumption,1
16,Baosteel,2024,Regulating capacity replacement,2
16,Baosteel,2024,Stimulating steel consumption,1
16,Baosteel,2024,Net-zero targets,11
16,Baosteel,2024,Fossil fuel transition,-1
6,TataSteelNederland,2022,"Pressure from stakeholders such as shareholders, customers, local residents, and governments to report on non-financial performance.",2
6,TataSteelNederland,2022,Commitment to create value in the long term.,4
6,TataSteelNederland,2022,Opportunity to contribute to a more sustainable world through product development.,6
6,TataSteelNederland,2022,Pressure from increasing sustainability requirements in steel applications.,1
6,TataSteelNederland,2022,"Opportunity to contribute to sustainable construction, sustainable transport, renewable power generation, and sustainable products.",-1
6,TataSteelNederland,2022,Commitment to making production greener and achieving green steel in a clean environment.,1
6,TataSteelNederland,2022,Pressure to reduce CO2 emissions from steel production.,1
6,TataSteelNederland,2023,Award of substantial Dutch and European subsidy in support of decarbonisation research,5
6,TataSteelNederland,2023,Importance placed on decarbonisation work by society,5
6,TataSteelNederland,2023,Legal requirements to reach net zero by 2050 in European countries,11
6,TataSteelNederland,2023,Clear direction from politicians on decarbonisation,5
6,TataSteelNederland,2023,Increased focus from society on decarbonisation,5
6,TataSteelNederland,2023,Obligation to contribute to net zero goals in the future,11
6,TataSteelNederland,2023,Ambition to be carbon neutral by 2045,3
6,TataSteelNederland,2024,EU's Green Deal and Fit for 55 package,-1
6,TataSteelNederland,2024,Carbon Border Adjustment Mechanism (CBAM),-1
6,TataSteelNederland,2024,European Union's net-zero target by 2050,11
6,TataSteelNederland,2024,Corporate Sustainability Reporting Directive (CSRD),2
6,TataSteelNederland,2024,European Sustainability Reporting Standards (ESRS),2
6,TataSteelNederland,2024,Emission Trading System (ETS),-1
6,TataSteelNederland,2024,EU-PRTR (European Pollutant Release and Transfer Register),-1
6,TataSteelNederland,2024,EUROFER's commitment to net-zero by 2050,11
6,TataSteelNederland,2024,Tata Steel Nederland's net-zero target by 2050,10
6,TataSteelNederland,2024,Tata Steel Nederland's commitment to reduce GHG emissions by 50% by 2030,10
6,TataSteelNederland,2024,Tata Steel Nederland's commitment to reduce energy consumption by 20% by 2030,10
6,TataSteelNederland,2024,Tata Steel Nederland's commitment to reduce CO2 emissions by 50% by 2030,10
6,TataSteelNederland,2024,Tata Steel Nederland's commitment to reduce CO2 emissions by 80% by 2040,10
6,TataSteelNederland,2024,Tata Steel Nederland's commitment to achieve net-zero by 2040,10
6,TataSteelNederland,2024,Tata Steel Nederland's commitment to reduce fossil fuel usage,10
6,TataSteelNederland,2024,Tata Steel Nederland's commitment to transition to low-carbon production,10
6,TataSteelNederland,2024,Tata Steel Nederland's commitment to invest in low-carbon technologies,10
6,TataSteelNederland,2024,Tata Steel Nederland's commitment to reduce dependence on fossil fuels,10
6,TataSteelNederland,2024,Tata Steel Nederland's commitment to reduce reliance on fossil fuels,10
6,TataSteelNederland,2024,Tata Steel Nederland's commitment to achieve carbon neutrality,10
6,TataSteelNederland,2024,Tata Steel Nederland's commitment to reduce carbon footprint,10
6,TataSteelNederland,2024,Tata Steel Nederland's commitment to reduce environmental impact,10
6,TataSteelNederland,2024,Tata Steel Nederland's commitment to reduce GHG emissions from operations,10
6,TataSteelNederland,2024,Tata Steel Nederland's commitment to reduce GHG emissions from supply chain,10
6,TataSteelNederland,2024,Tata Steel Nederland's commitment to reduce GHG emissions from production,10
6,TataSteelNederland,2024,Tata Steel Nederland's commitment to reduce GHG emissions from transportation,10
6,TataSteelNederland,2024,Tata Steel Nederland's commitment to reduce GHG emissions from energy consumption,10
6,TataSteelNederland,2024,Tata Steel Nederland's commitment to reduce GHG emissions from industrial processes,10
6,TataSteelNederland,2024,Tata Steel Nederland's commitment to reduce GHG emissions from waste management,10
6,TataSteelNederland,2024,Tata Steel Nederland's commitment to reduce GHG emissions from land use changes,10
6,TataSteelNederland,2024,Tata Steel Nederland's commitment to reduce GHG emissions from product use and end-of-life,10
6,TataSteelNederland,2024,Tata Steel Nederland's commitment to reduce GHG emissions from supply chain operations,10
6,TataSteelNederland,2024,Tata Steel Nederland's commitment to reduce GHG emissions from supply chain transportation,10
6,TataSteelNederland,2024,Tata Steel Nederland's commitment to reduce GHG emissions from supply chain energy consumption,10
6,TataSteelNederland,2024,Tata Steel Nederland's commitment to reduce GHG emissions from supply chain industrial processes,10
6,TataSteelNederland,2024,Tata Steel Nederland's commitment to reduce GHG emissions from supply chain waste management,10
6,TataSteelNederland,2024,Tata Steel Nederland's commitment to reduce GHG emissions from supply chain land use changes,10
6,TataSteelNederland,2024,Tata Steel Nederland's commitment to reduce GHG emissions from supply chain product use and end-of-life,10
6,TataSteelNederland,2024,Tata Steel Nederland's,10
2,Acerinox,2021,Climate change and energy,8
2,Acerinox,2021,Circular economy,14
2,Acerinox,2021,Water consumption management,14
2,Acerinox,2022,Pressure from emissions-limiting regulations,2
2,Acerinox,2022,Commitment to reduce Scope 1 emissions,0
2,Acerinox,2022,Opportunity to improve energy efficiency,7
2,Acerinox,2022,Incentive to increase renewable energy usage,13
2,Acerinox,2022,Pressure to reduce air emissions of pollutants,0
2,Acerinox,2022,Commitment to manage Scope 1 emissions,0
2,Acerinox,2022,Opportunity to reduce GHG emissions intensity,0
2,Acerinox,2022,Incentive to transition away from fossil fuels,-1
2,Acerinox,2022,Commitment to achieve net-zero targets,11
2,Acerinox,2022,Opportunity to improve energy management,7
2,Acerinox,2022,Incentive to reduce waste generated,0
2,Acerinox,2022,Pressure to divert waste from disposal,0
2,Acerinox,2022,Commitment to manage significant waste-related impacts,0
2,Acerinox,2022,Opportunity to reduce nitrogen oxides (NOx) and sulphur oxides (SOx) emissions,0
2,Acerinox,2022,Incentive to reduce ozone-depleting substances (ODS) emissions,0
2,Acerinox,2022,Pressure to reduce GHG emissions,0
2,Acerinox,2022,Commitment to reduce GHG emissions intensity,0
2,Acerinox,2022,Opportunity to improve waste management practices,0
2,Acerinox,2022,Incentive to reduce waste directed to disposal,0
2,Acerinox,2022,Pressure to reduce GHG emissions in the supply chain,0
2,Acerinox,2022,Commitment to screen new suppliers using environmental criteria,0
2,Acerinox,2022,Opportunity to reduce negative environmental impacts in the supply chain,0
2,Acerinox,2022,Incentive to achieve long-term and short-term strategy or plan to manage Scope 1 emissions,0
2,Acerinox,2023,Transition - market,-1
2,Acerinox,2023,Decrease in demand,1
2,Acerinox,2023,Setting of 2030 sustainability targets,4
2,Acerinox,2023,Changes in customer preferences,6
2,Acerinox,2023,Sustainability Master Plan - Positive Impact 360º,4
